{
  "$schema": "http://json-schema.org/draft-07/schema#",
  "title": "Canvas Instance Manifest",
  "description": "Per-canvas-instance state: which local MD files map to which canvas IDs.",
  "type": "object",
  "required": ["instance", "artifacts"],
  "properties": {
    "instance": {
      "type": "object",
      "required": ["name", "base_url", "course_id"],
      "properties": {
        "name": {
          "type": "string",
          "description": "Instance identifier (e.g., 'sandbox', 'production')"
        },
        "base_url": {
          "type": "string",
          "format": "uri"
        },
        "course_id": {
          "type": "integer",
          "minimum": 1
        },
        "term": {
          "type": "string"
        },
        "enabled": {
          "type": "boolean",
          "description": "Set false on scaffold profiles to make every Canvas-touching tool refuse to run against this instance. Absent means enabled."
        }
      }
    },
    "hosted_html": {
      "type": "object",
      "properties": {
        "enabled": {
          "type": "boolean"
        },
        "base_url": {
          "type": "string",
          "format": "uri"
        },
        "path_prefix": {
          "type": "string",
          "pattern": "^[a-z0-9][a-z0-9_/-]*$"
        },
        "assignment_copy_ui": {
          "type": "boolean",
          "description": "Set false to remove generated assignment copy controls, retaining downloads and transcript prompt copying."
        },
        "native_canvas_navigation": {
          "type": "boolean",
          "description": "Use native Canvas completion/submission controls without hosted Canvas-ID shortcuts or personalized progress."
        },
        "progress_endpoint": {
          "type": "string",
          "format": "uri"
        }
      }
    },
    "canvas_publish": {
      "type": "boolean",
      "description": "Set false for courses whose hosted output should render without publishing Markdown artifacts to Canvas."
    },
    "ai_activity": {
      "type": "object",
      "properties": {
        "default_ai_endpoint": {
          "type": "string",
          "format": "uri"
        },
        "course_theme": {
          "type": "string"
        }
      }
    },
    "last_sync": {
      "type": ["string", "null"],
      "format": "date-time"
    },
    "artifacts": {
      "type": "object",
      "description": "Keyed by repo-relative MD file path",
      "additionalProperties": {
        "type": "object",
        "required": ["canvas_type", "content_hash"],
        "properties": {
          "canvas_type": {
            "type": "string",
            "enum": ["assignment", "page", "discussion", "quiz", "module_header"]
          },
          "source_type": {
            "type": "string",
            "enum": ["assignment", "page", "discussion", "quiz", "module_header"]
          },
          "delivery_mode": {
            "type": "string",
            "enum": ["canvas_native", "ai_activity", "guided_assignment"]
          },
          "canvas_id": {
            "type": ["integer", "null"]
          },
          "canvas_page_url": {
            "type": ["string", "null"],
            "description": "Page URL slug (pages don't use numeric IDs in canvas)"
          },
          "canvas_module_id": {
            "type": ["integer", "null"]
          },
          "canvas_module_item_id": {
            "type": ["integer", "null"]
          },
          "completion_requirement": {
            "type": "string",
            "enum": ["must_view", "must_submit", "must_contribute", "must_mark_done", "min_score"]
          },
          "content_hash": {
            "type": "string",
            "pattern": "^[a-f0-9]{64}$"
          },
          "last_pushed": {
            "type": ["string", "null"],
            "format": "date-time"
          },
          "last_pulled": {
            "type": ["string", "null"],
            "format": "date-time"
          },
          "hosted_path": {
            "type": "string"
          },
          "hosted_url": {
            "type": "string",
            "format": "uri"
          },
          "hosted_hash": {
            "type": "string",
            "pattern": "^[a-f0-9]{64}$"
          },
          "hosted_last_rendered": {
            "type": ["string", "null"],
            "format": "date-time"
          },
          "orphaned": {
            "type": "boolean",
            "description": "True if the artifact exists in manifest but is gone from canvas"
          }
        }
      }
    }
  }
}
